{
  "schemaVersion": "1.0.0",
  "updatedAt": "2026-10-22T00:00:00.000Z",
  "diagnosticItems": [
    {
      "itemId": "diag-early-01",
      "skillId": "num-pre-number-counting-20",
      "domainId": "foundational-numeracy",
      "targetYearId": "ukg",
      "difficulty": "foundation",
      "prompt": {
        "en": "Aarav arranges clay beads in the pattern: Red, Blue, Red, Blue, Red, [ ? ]. Which bead comes next?",
        "hi": "आरव मिट्टी के मोतियों को इस क्रम में रखता है: लाल, नीला, लाल, नीला, लाल, [ ? ]। अगला मोती कौन-सा होगा?"
      },
      "options": [
        {
          "en": "Blue",
          "hi": "नीला"
        },
        {
          "en": "Red",
          "hi": "लाल"
        },
        {
          "en": "Green",
          "hi": "हरा"
        },
        {
          "en": "Yellow",
          "hi": "पीला"
        }
      ],
      "correctIndex": 0,
      "explanation": {
        "en": "The pattern alternates Red and Blue (ABAB). After Red, the next bead is Blue.",
        "hi": "यह लाल और नीले का एकांतर (ABAB) पैटर्न है। लाल के बाद नीला मोती आएगा।"
      },
      "sourceIds": [
        "SRC-MWCD-AADHARSHILA-2024",
        "SRC-NCERT-NCFFS-2022"
      ]
    },
    {
      "itemId": "diag-found-02",
      "skillId": "num-place-value-add-sub",
      "domainId": "foundational-numeracy",
      "targetYearId": "class-02",
      "difficulty": "core",
      "prompt": {
        "en": "Meera has 3 bundles of 10 sticks and 14 loose sticks. What total number of sticks does she have?",
        "hi": "मीरा के पास 10-10 तीलियों के 3 गट्ठर और 14 खुली तीलियां हैं। उसके पास कुल कितनी तीलियां हैं?"
      },
      "options": [
        {
          "en": "44",
          "hi": "44"
        },
        {
          "en": "314",
          "hi": "314"
        },
        {
          "en": "34",
          "hi": "34"
        },
        {
          "en": "17",
          "hi": "17"
        }
      ],
      "correctIndex": 0,
      "explanation": {
        "en": "3 tens = 30, plus 14 ones (1 ten + 4 ones) = 4 tens and 4 ones = 44.",
        "hi": "3 दहाई = 30, और 14 इकाई = 30 + 14 = 44 तीलियां।"
      },
      "sourceIds": [
        "SRC-NCERT-NCFFS-2022"
      ]
    },
    {
      "itemId": "diag-prep-03",
      "skillId": "num-mult-div-fractions-prep",
      "domainId": "foundational-numeracy",
      "targetYearId": "class-05",
      "difficulty": "core",
      "prompt": {
        "en": "Which of the following fractions is equivalent to 3/4?",
        "hi": "निम्नलिखित में से कौन-सी भिन्न 3/4 के समतुल्य है?"
      },
      "options": [
        {
          "en": "9/12",
          "hi": "9/12"
        },
        {
          "en": "6/12",
          "hi": "6/12"
        },
        {
          "en": "4/3",
          "hi": "4/3"
        },
        {
          "en": "7/8",
          "hi": "7/8"
        }
      ],
      "correctIndex": 0,
      "explanation": {
        "en": "Multiplying numerator and denominator of 3/4 by 3 gives (3 x 3)/(4 x 3) = 9/12.",
        "hi": "3/4 के अंश और हर को 3 से गुणा करने पर 9/12 प्राप्त होता है।"
      },
      "sourceIds": [
        "SRC-NCERT-NCFSE-2023"
      ]
    },
    {
      "itemId": "diag-mid-math-04",
      "skillId": "math-integers-number-patterns",
      "domainId": "mathematics-core",
      "targetYearId": "class-06",
      "difficulty": "core",
      "prompt": {
        "en": "In Srinagar, the temperature at midnight is -4 C. By morning it drops by another 3 C. What is the morning temperature?",
        "hi": "श्रीनगर में आधी रात का तापमान -4 C है। सुबह तक यह 3 C और गिर जाता है। सुबह का तापमान क्या है?"
      },
      "options": [
        {
          "en": "-7 C",
          "hi": "-7 C"
        },
        {
          "en": "-1 C",
          "hi": "-1 C"
        },
        {
          "en": "+7 C",
          "hi": "+7 C"
        },
        {
          "en": "+1 C",
          "hi": "+1 C"
        }
      ],
      "correctIndex": 0,
      "explanation": {
        "en": "Starting at -4 and moving 3 units left on the number line gives (-4) + (-3) = -7 C.",
        "hi": "संख्या रेखा पर -4 से 3 इकाई बाईं ओर जाने पर (-4) - 3 = -7 C मिलता है।"
      },
      "sourceIds": [
        "SRC-NCERT-NCFSE-2023",
        "SRC-CBSE-CURR-2026-27"
      ]
    },
    {
      "itemId": "diag-mid-alg-05",
      "skillId": "math-ratios-linear-algebra-middle",
      "domainId": "mathematics-core",
      "targetYearId": "class-08",
      "difficulty": "core",
      "prompt": {
        "en": "Solve for x: 3(2x - 1) = 4x + 7",
        "hi": "x का मान ज्ञात कीजिए: 3(2x - 1) = 4x + 7"
      },
      "options": [
        {
          "en": "x = 5",
          "hi": "x = 5"
        },
        {
          "en": "x = 2",
          "hi": "x = 2"
        },
        {
          "en": "x = 4",
          "hi": "x = 4"
        },
        {
          "en": "x = -5",
          "hi": "x = -5"
        }
      ],
      "correctIndex": 0,
      "explanation": {
        "en": "Expanding gives 6x - 3 = 4x + 7 -> 2x = 10 -> x = 5.",
        "hi": "विस्तार करने पर 6x - 3 = 4x + 7 -> 2x = 10 -> x = 5 प्राप्त होता है।"
      },
      "sourceIds": [
        "SRC-NCERT-NCFSE-2023",
        "SRC-CBSE-CURR-2026-27"
      ]
    },
    {
      "itemId": "diag-mid-sci-06",
      "skillId": "sci-curiosity-middle-inquiry",
      "domainId": "science-and-inquiry",
      "targetYearId": "class-07",
      "difficulty": "core",
      "prompt": {
        "en": "When a few drops of dilute iodine solution are added to boiled rice, it turns blue-black. This indicates the presence of:",
        "hi": "जब उबले हुए चावल में तनु आयोडीन घोल की कुछ बूंदें डाली जाती हैं, तो वह नीला-काला हो जाता है। यह किसकी उपस्थिति दर्शाता है?"
      },
      "options": [
        {
          "en": "Starch (Carbohydrate)",
          "hi": "मंड (स्टार्च / कार्बोहाइड्रेट)"
        },
        {
          "en": "Protein",
          "hi": "प्रोटीन"
        },
        {
          "en": "Fat",
          "hi": "वसा"
        },
        {
          "en": "Vitamin C",
          "hi": "विटामिन सी"
        }
      ],
      "correctIndex": 0,
      "explanation": {
        "en": "Iodine reacts with amylose in starch to form a characteristic blue-black complex (NCERT Curiosity).",
        "hi": "आयोडीन स्टार्च (मंड) के साथ अभिक्रिया करके नीला-काला रंग देता है (एनसीईआरटी जिज्ञासा)।"
      },
      "sourceIds": [
        "SRC-NCERT-NCFSE-2023"
      ]
    },
    {
      "itemId": "diag-sec-math-07",
      "skillId": "math-polynomials-quadratics-sec",
      "domainId": "mathematics-core",
      "targetYearId": "class-10",
      "difficulty": "stretch",
      "prompt": {
        "en": "For what value of k does the quadratic equation x^2 - 6x + k = 0 have two equal real roots?",
        "hi": "k के किस मान के लिए द्विघात समीकरण x^2 - 6x + k = 0 के दो बराबर वास्तविक मूल होंगे?"
      },
      "options": [
        {
          "en": "k = 9",
          "hi": "k = 9"
        },
        {
          "en": "k = 6",
          "hi": "k = 6"
        },
        {
          "en": "k = -9",
          "hi": "k = -9"
        },
        {
          "en": "k = 3",
          "hi": "k = 3"
        }
      ],
      "correctIndex": 0,
      "explanation": {
        "en": "Equal real roots occur when discriminant D = b^2 - 4ac = 0 -> (-6)^2 - 4(1)(k) = 0 -> 36 - 4k = 0 -> k = 9.",
        "hi": "बराबर मूलों के लिए विविक्तकर D = b^2 - 4ac = 0 -> 36 - 4k = 0 -> k = 9।"
      },
      "sourceIds": [
        "SRC-CBSE-CURR-2026-27",
        "SRC-NTA-JEEMAIN-2026"
      ]
    },
    {
      "itemId": "diag-srsec-calc-08",
      "skillId": "math-calculus-vectors-srsec",
      "domainId": "mathematics-core",
      "targetYearId": "class-12",
      "difficulty": "stretch",
      "prompt": {
        "en": "What is the derivative d/dx of f(x) = x^3 - 5x^2 + 7 at x = 2?",
        "hi": "x = 2 पर फलन f(x) = x^3 - 5x^2 + 7 का अवकलज (d/dx) क्या है?"
      },
      "options": [
        {
          "en": "-8",
          "hi": "-8"
        },
        {
          "en": "12",
          "hi": "12"
        },
        {
          "en": "-4",
          "hi": "-4"
        },
        {
          "en": "0",
          "hi": "0"
        }
      ],
      "correctIndex": 0,
      "explanation": {
        "en": "f'(x) = 3x^2 - 10x. Evaluating at x = 2 gives 3(4) - 10(2) = 12 - 20 = -8.",
        "hi": "f'(x) = 3x^2 - 10x। x = 2 रखने पर 3(4) - 20 = -8 प्राप्त होता है।"
      },
      "sourceIds": [
        "SRC-CBSE-CURR-2026-27",
        "SRC-NTA-JEEMAIN-2026"
      ]
    },
    {
      "itemId": "diag-global-lang-09",
      "skillId": "lang-academic-rhetoric-global-exams",
      "domainId": "languages-and-communication",
      "targetYearId": "class-11",
      "difficulty": "stretch",
      "prompt": {
        "en": "Choose the punctuation that conforms to Standard English conventions: 'Solar microgrids reduce transmission losses ______ they require local battery storage to handle monsoon cloud cover.'",
        "hi": "मानक अंग्रेजी विराम-चिह्न चुनें: 'Solar microgrids reduce transmission losses ______ they require local battery storage to handle monsoon cloud cover.'"
      },
      "options": [
        {
          "en": "losses; however,",
          "hi": "losses; however,"
        },
        {
          "en": "losses, however,",
          "hi": "losses, however,"
        },
        {
          "en": "losses however",
          "hi": "losses however"
        },
        {
          "en": "losses: however",
          "hi": "losses: however"
        }
      ],
      "correctIndex": 0,
      "explanation": {
        "en": "Joining two independent clauses with the conjunctive adverb 'however' requires a semicolon before and a comma after.",
        "hi": "दो स्वतंत्र उपवाक्यों को 'however' से जोड़ने के लिए पहले अर्धविराम (;) और बाद में अल्पविराम (,) आवश्यक है।"
      },
      "sourceIds": [
        "SRC-CB-DIGITALSAT-2026",
        "SRC-IELTS-ACADEMIC-2026"
      ]
    }
  ],
  "mockBlueprints": [
    {